{
  "schema": "arena-calibration.case-manifest.v1",
  "batchId": "cf6-bladebot-combat-audio-20261017-arkclaw-l60-w2",
  "createdAt": "2026-10-17T05:06:53.257Z",
  "buildCommit": "0392d8144c20d62261b01df54e6787b845f75e73",
  "planner": {
    "name": "cf6-bladebot-wave-arkclaw",
    "version": 2
  },
  "arenaMode": "calibration",
  "repeat": 1,
  "timeoutFrames": 5400,
  "blueBench": null,
  "cases": [
    {
      "caseId": "level60-red",
      "blueRoster": [
        {
          "type": "兵种286",
          "level": 60,
          "sourceId": "arkclaw-60"
        }
      ],
      "redRoster": [
        {
          "type": "兵种465",
          "level": 60,
          "sourceId": "bladebot-60"
        }
      ],
      "repeat": 2,
      "timeoutFrames": 5400,
      "tags": [
        "cf6-bladebot",
        "arkclaw",
        "wave-combo",
        "red"
      ],
      "plannerReason": "同等级交换阵营复验大刀的重劈击退接波光束；保留全部重复、胜负与超时。",
      "spawnDistance": 650,
      "blueFormation": "line",
      "redFormation": "line",
      "formationSpacing": 54,
      "authorityContext": {
        "candidateSide": "red",
        "candidateUnitId": 465,
        "level": 60,
        "rivalUnitId": 286,
        "sourceBindings": [
          {
            "path": "flashswf/arts/new/Codex大刀机器人素材.swf",
            "sha256": "38689a02fbcebdcb8ae8902535bba9841795732efac5e2da61dc5cf57f7e50e0"
          },
          {
            "path": "flashswf/arts/things-new.swf",
            "sha256": "0eeb0fe6eac14980a84fe6270ec193478aed1b3348556291a3e2b9a2d30b57f9"
          },
          {
            "path": "flashswf/arts/new/素材库-诺亚新敌人.swf",
            "sha256": "53d06b7c3808a6ccdf230953eef31dc43f7c3b9334ebe50f37aa7061501bba5d"
          },
          {
            "path": "scripts/asLoader.swf",
            "sha256": "7f0ff06c53d46cf7786ca766ad9eba1cf5a0da21bc6ec1fa1b149739b4b09850"
          },
          {
            "path": "data/enemy_properties/CF6重制敌人.xml",
            "sha256": "be52b01b30a54d966691004ae50800c4aff906bc9207d893215c88d97aa1871c"
          },
          {
            "path": "data/enemy_properties/诺亚新敌人.xml",
            "sha256": "d339f0a4de759cce186fe98dbdf8f1f966cacf1fa5bd803714d9d41ea331321b"
          },
          {
            "path": "data/units/units.json",
            "sha256": "13859cd4c7192857be1c2fe568fea34f213386d832012529cc2de0105044d868"
          },
          {
            "path": "data/items/asset_source_map.xml",
            "sha256": "493a827672392f3c7e5dd07345c7f9728c668bb0021e1d5ebcc9f328b31c3e7c"
          },
          {
            "path": "launcher/web/modules/arena-unit-catalog.js",
            "sha256": "d40778144f21450e4b59f089afec1478adedd34d47d532e0c3582bc1720bdda5"
          },
          {
            "path": "tools/cf6-bladebot-assets/BladebotAI.as",
            "sha256": "c1f421d8cdec61d1dcc68100da604cd380b5acc5ce426c2621558a40a7d7079c"
          },
          {
            "path": "tools/cf6-bladebot-assets/build.py",
            "sha256": "ba181db9136cb80e0b7dd9d4d45faea7b773cbe3b5d84a15b4fe6a111f407add"
          },
          {
            "path": "tools/cf6-bladebot-assets/native-manifest.json",
            "sha256": "7c74bd73de2d3a8a886e9224110e4f2a7205494b9d84ce7204234d8c6eae0897"
          },
          {
            "path": "tools/cf6-bladebot-assets/balance-inputs.json",
            "sha256": "a21317cfaa091dd5cd4c88259c5244fed39a8daebe0f9b2ee5e29c27cfee4407"
          },
          {
            "path": "scripts/逻辑/单位函数/单位函数_lsy_敌人模板迁移.as",
            "sha256": "ce1385ebf3fc3a424b9e56f271f22b25f0a6d8c78656a310e517fccd72dabbb0"
          }
        ],
        "stage": 8,
        "targetPosition": "meaningful_threat",
        "tier": 9,
        "variant": "wave-combo"
      },
      "caseHash": "sha256:9da2f69193a53e83248fb009f25c07dab854bd87ef21f6ace0b0dcbfae26ce1c"
    }
  ],
  "manifestHash": "sha256:e05c474816d0463ca481923d5ddf5a2af586af4595083bdec1ec5aa3eb28da0c"
}
