{
  "schema": "arena-calibration.case-manifest.v1",
  "batchId": "gate-f-week-c2-p1",
  "createdAt": "2026-08-27T15:03:00.000Z",
  "buildCommit": "732898b8aa1308cf820976324f47bba97f654e41",
  "planner": {
    "name": "gate-f-week-plan",
    "version": 1,
    "phase": "standard",
    "candidateIds": [
      "candidate-5916c1cceeba49d5"
    ],
    "sourceCell": "C2",
    "sourceCandidateHash": "sha256:5916c1cceeba49d5d60ac6891b5c6d4ab9e9194a708cd6a8758c27658d162742",
    "phaseIndex": 1,
    "phaseRuns": 10
  },
  "arenaMode": "calibration",
  "repeat": 1,
  "timeoutFrames": 1800,
  "blueBench": null,
  "cases": [
    {
      "caseId": "candidate-5916c1cceeba49d5",
      "blueRoster": [
        {
          "type": "兵种44",
          "level": 20
        }
      ],
      "redRoster": [
        {
          "type": "兵种7",
          "level": 20
        },
        {
          "type": "兵种7",
          "level": 20
        },
        {
          "type": "兵种10",
          "level": 20
        },
        {
          "type": "兵种10",
          "level": 20
        }
      ],
      "repeat": 5,
      "timeoutFrames": 1800,
      "tags": [
        "xlsx-intake",
        "source-c2",
        "gate-f-week",
        "standard"
      ],
      "plannerReason": "workbook sha256:840b30af82ca686e954dc4a6378a5c2b297506070e034ed79ea91da9e0b3b793 斗兽标定组合!C2; Gate F standard original",
      "spawnDistance": 650,
      "blueFormation": "line",
      "redFormation": "line",
      "formationSpacing": 54,
      "caseHash": "sha256:8713aea03914340c8ee6543280c51acad011d99cb5f4a1312e8466b610be52bd"
    },
    {
      "caseId": "candidate-5916c1cceeba49d5-side-swap",
      "blueRoster": [
        {
          "type": "兵种7",
          "level": 20
        },
        {
          "type": "兵种7",
          "level": 20
        },
        {
          "type": "兵种10",
          "level": 20
        },
        {
          "type": "兵种10",
          "level": 20
        }
      ],
      "redRoster": [
        {
          "type": "兵种44",
          "level": 20
        }
      ],
      "repeat": 5,
      "timeoutFrames": 1800,
      "tags": [
        "xlsx-intake",
        "source-c2",
        "gate-f-week",
        "standard",
        "side-swap"
      ],
      "plannerReason": "workbook sha256:840b30af82ca686e954dc4a6378a5c2b297506070e034ed79ea91da9e0b3b793 斗兽标定组合!C2; Gate F standard swapped",
      "spawnDistance": 650,
      "blueFormation": "line",
      "redFormation": "line",
      "formationSpacing": 54,
      "caseHash": "sha256:ef0167394a7ef99a7a1df060709e5dc562123164d2a5b6c51aaa3b205dfbc4ee"
    }
  ],
  "manifestHash": "sha256:ed306d5719f3f682de23f5eff4382b99e068669b8bab3a334798aceb122c64b4"
}
