{
  "schema": "arena-calibration.case-manifest.v1",
  "batchId": "gate-f-week-f8-p2",
  "createdAt": "2026-08-30T06:52:00.000Z",
  "buildCommit": "bcfa01935d2f91a29a8a537c328c9190827c4be3",
  "planner": {
    "name": "gate-f-week-plan",
    "version": 1,
    "phase": "standard",
    "candidateIds": [
      "candidate-a89656e36e027f0b"
    ],
    "sourceCell": "F8",
    "sourceCandidateHash": "sha256:a89656e36e027f0b5d1c606dd0300f73363f4116bc70b0b77f327c458beacaef",
    "phaseIndex": 2,
    "phaseRuns": 20
  },
  "arenaMode": "calibration",
  "repeat": 1,
  "timeoutFrames": 1800,
  "blueBench": null,
  "cases": [
    {
      "caseId": "candidate-a89656e36e027f0b",
      "blueRoster": [
        {
          "type": "兵种445",
          "level": 40
        }
      ],
      "redRoster": [
        {
          "type": "兵种59",
          "level": 30
        }
      ],
      "repeat": 10,
      "timeoutFrames": 1800,
      "tags": [
        "xlsx-intake",
        "source-f8",
        "gate-f-week",
        "standard"
      ],
      "plannerReason": "workbook sha256:840b30af82ca686e954dc4a6378a5c2b297506070e034ed79ea91da9e0b3b793 斗兽标定组合!F8; Gate F standard original",
      "spawnDistance": 650,
      "blueFormation": "line",
      "redFormation": "line",
      "formationSpacing": 54,
      "caseHash": "sha256:3330a05534a831d2e7970f5a095b6f5a9c6ae62360a2ada9c4ca6c3c5a8fab9e"
    },
    {
      "caseId": "candidate-a89656e36e027f0b-side-swap",
      "blueRoster": [
        {
          "type": "兵种59",
          "level": 30
        }
      ],
      "redRoster": [
        {
          "type": "兵种445",
          "level": 40
        }
      ],
      "repeat": 10,
      "timeoutFrames": 1800,
      "tags": [
        "xlsx-intake",
        "source-f8",
        "gate-f-week",
        "standard",
        "side-swap"
      ],
      "plannerReason": "workbook sha256:840b30af82ca686e954dc4a6378a5c2b297506070e034ed79ea91da9e0b3b793 斗兽标定组合!F8; Gate F standard swapped",
      "spawnDistance": 650,
      "blueFormation": "line",
      "redFormation": "line",
      "formationSpacing": 54,
      "caseHash": "sha256:4034af4a8bcd6e1529cfd620af80d458f60857750070f85f0c4d1f5cb82883b5"
    }
  ],
  "manifestHash": "sha256:18c6f2cc632ba3f0445cf5dcd1ea24aaa4f69e56ed3ea2d3b287d3d4e526967f"
}
