{
  "schema": "arena-calibration.case-manifest.v1",
  "batchId": "gate-f-week-d2-p2",
  "createdAt": "2026-08-30T06:52:00.000Z",
  "buildCommit": "bcfa01935d2f91a29a8a537c328c9190827c4be3",
  "planner": {
    "name": "gate-f-week-plan",
    "version": 1,
    "phase": "standard",
    "candidateIds": [
      "candidate-bc74763292a63c5c"
    ],
    "sourceCell": "D2",
    "sourceCandidateHash": "sha256:bc74763292a63c5c0d6683abc7ae1e70a8bb920fe5ff0f21fe9d09bdbb41f1b8",
    "phaseIndex": 2,
    "phaseRuns": 20
  },
  "arenaMode": "calibration",
  "repeat": 1,
  "timeoutFrames": 1800,
  "blueBench": null,
  "cases": [
    {
      "caseId": "candidate-bc74763292a63c5c",
      "blueRoster": [
        {
          "type": "兵种47",
          "level": 20
        },
        {
          "type": "兵种47",
          "level": 20
        }
      ],
      "redRoster": [
        {
          "type": "兵种7",
          "level": 20
        },
        {
          "type": "兵种7",
          "level": 20
        },
        {
          "type": "兵种10",
          "level": 20
        },
        {
          "type": "兵种10",
          "level": 20
        }
      ],
      "repeat": 10,
      "timeoutFrames": 1800,
      "tags": [
        "xlsx-intake",
        "source-d2",
        "gate-f-week",
        "standard"
      ],
      "plannerReason": "workbook sha256:840b30af82ca686e954dc4a6378a5c2b297506070e034ed79ea91da9e0b3b793 斗兽标定组合!D2; Gate F standard original",
      "spawnDistance": 650,
      "blueFormation": "line",
      "redFormation": "line",
      "formationSpacing": 54,
      "caseHash": "sha256:6dc29d81bcc043d4915be0a61006bf6b91cef232f167386ac783b6fe3be53f2d"
    },
    {
      "caseId": "candidate-bc74763292a63c5c-side-swap",
      "blueRoster": [
        {
          "type": "兵种7",
          "level": 20
        },
        {
          "type": "兵种7",
          "level": 20
        },
        {
          "type": "兵种10",
          "level": 20
        },
        {
          "type": "兵种10",
          "level": 20
        }
      ],
      "redRoster": [
        {
          "type": "兵种47",
          "level": 20
        },
        {
          "type": "兵种47",
          "level": 20
        }
      ],
      "repeat": 10,
      "timeoutFrames": 1800,
      "tags": [
        "xlsx-intake",
        "source-d2",
        "gate-f-week",
        "standard",
        "side-swap"
      ],
      "plannerReason": "workbook sha256:840b30af82ca686e954dc4a6378a5c2b297506070e034ed79ea91da9e0b3b793 斗兽标定组合!D2; Gate F standard swapped",
      "spawnDistance": 650,
      "blueFormation": "line",
      "redFormation": "line",
      "formationSpacing": 54,
      "caseHash": "sha256:f600ba1b828bdb8d76cb63dbebd0f61774bd82fb4e6ac738c1602588a0563d44"
    }
  ],
  "manifestHash": "sha256:ea0df62958519da1635e0780c98f15e3aadffdf8caf439f97aa537a073140992"
}
