{
  "schema": "arena-calibration.case-manifest.v1",
  "batchId": "cf6-cold-r3-20261017-cold1",
  "createdAt": "2026-10-17T15:48:20.508Z",
  "buildCommit": "0392d8144c20d62261b01df54e6787b845f75e73",
  "planner": {
    "name": "cf6-cold-entry-readiness",
    "version": 1
  },
  "arenaMode": "calibration",
  "repeat": 1,
  "timeoutFrames": 60,
  "blueBench": null,
  "cases": [
    {
      "caseId": "cold1",
      "blueRoster": [
        {
          "type": "兵种470",
          "level": 30,
          "sourceId": "headbot-30"
        }
      ],
      "redRoster": [
        {
          "type": "兵种286",
          "level": 30,
          "sourceId": "arkclaw-30"
        }
      ],
      "repeat": 1,
      "timeoutFrames": 60,
      "tags": [
        "cold-entry-readiness",
        "not-balance"
      ],
      "plannerReason": "只验证真实冷启动、揭幕和随后60帧玩法时钟；预期按时限结束，不纳入斗兽强度结果。",
      "spawnDistance": 650,
      "blueFormation": "line",
      "redFormation": "line",
      "formationSpacing": 54,
      "authorityContext": {
        "acceptedForStrength": false,
        "candidateSide": "blue",
        "candidateUnitId": 470,
        "level": 30,
        "rivalUnitId": 286,
        "sourceBindings": [
          {
            "path": "flashswf/arts/new/Codex大头机器人素材.swf",
            "sha256": "4008c8785676464f8bc66659d07888cae1749376d4dd7f2beb286e9c51a1daaa"
          },
          {
            "path": "flashswf/arts/things-new.swf",
            "sha256": "0eeb0fe6eac14980a84fe6270ec193478aed1b3348556291a3e2b9a2d30b57f9"
          },
          {
            "path": "flashswf/arts/new/素材库-诺亚新敌人.swf",
            "sha256": "d8088f76a8ffa08c9c8e8a4d54ca9752fce8d696d475945b388ccaca7618adc6"
          },
          {
            "path": "scripts/asLoader.swf",
            "sha256": "2e2b3de9c85b429975722ab96e45e13c08144d74225c11099d3668b06df5c43e"
          },
          {
            "path": "data/enemy_properties/CF6重制敌人.xml",
            "sha256": "cf2164bcfa70070432df2a20b0766fe700c935b5621913d755910476cb8f3333"
          },
          {
            "path": "data/enemy_properties/诺亚新敌人.xml",
            "sha256": "d339f0a4de759cce186fe98dbdf8f1f966cacf1fa5bd803714d9d41ea331321b"
          },
          {
            "path": "data/units/units.json",
            "sha256": "13859cd4c7192857be1c2fe568fea34f213386d832012529cc2de0105044d868"
          },
          {
            "path": "data/items/asset_source_map.xml",
            "sha256": "493a827672392f3c7e5dd07345c7f9728c668bb0021e1d5ebcc9f328b31c3e7c"
          },
          {
            "path": "launcher/web/modules/arena-unit-catalog.js",
            "sha256": "d40778144f21450e4b59f089afec1478adedd34d47d532e0c3582bc1720bdda5"
          },
          {
            "path": "tools/cf6-headbot-assets/HeadbotAI.as",
            "sha256": "554f0a0e463809d4e058022a3ed9093f863a03a03814a62041b044d68b6370ae"
          },
          {
            "path": "tools/cf6-headbot-assets/build.py",
            "sha256": "69b83ff8a2a0441a42274051f263506ee5eace85709defc470993dde6f8f4003"
          },
          {
            "path": "tools/cf6-headbot-assets/native-manifest.json",
            "sha256": "d27ec2d07151c7f097ffea5b20024b6de5ecb38071e5289eb5112331ca1c7d1a"
          },
          {
            "path": "tools/cf6-headbot-assets/balance-inputs.json",
            "sha256": "83ac79714f048a1007fb8b87ac11b631517489091761bdac874584c279a00e20"
          }
        ],
        "stage": 7,
        "targetPosition": "cold_entry_readiness_only",
        "tier": 16,
        "variant": "wave"
      },
      "caseHash": "sha256:9e8bf90ae2ca2fc60e31b3f86127c726ce783c0364a900639228608afacca897"
    }
  ],
  "manifestHash": "sha256:2770bf7133d04463f82744a215874984781fec32a54ba221f5fe4505c2449ffb"
}
