{
  "schema": "arena-calibration.case-manifest.v1",
  "batchId": "cf6-cal-final-headbot-20261017-l60-w2",
  "createdAt": "2026-10-17T09:47:23.565Z",
  "buildCommit": "0392d8144c20d62261b01df54e6787b845f75e73",
  "planner": {
    "name": "cf6-headbot-arkclaw",
    "version": 2
  },
  "arenaMode": "calibration",
  "repeat": 1,
  "timeoutFrames": 3600,
  "blueBench": null,
  "cases": [
    {
      "caseId": "level60-red",
      "blueRoster": [
        {
          "type": "兵种286",
          "level": 60,
          "sourceId": "arkclaw-60"
        }
      ],
      "redRoster": [
        {
          "type": "兵种470",
          "level": 60,
          "sourceId": "headbot-60"
        }
      ],
      "repeat": 3,
      "timeoutFrames": 3600,
      "tags": [
        "cf6-headbot",
        "arkclaw",
        "wave",
        "red"
      ],
      "plannerReason": "同等级、交换阵营检验大头机器人稳定击败方舟爪豪的定位；保留全部重复、败局与超时。",
      "spawnDistance": 650,
      "blueFormation": "line",
      "redFormation": "line",
      "formationSpacing": 54,
      "authorityContext": {
        "candidateSide": "red",
        "candidateUnitId": 470,
        "level": 60,
        "rivalUnitId": 286,
        "sourceBindings": [
          {
            "path": "flashswf/arts/new/Codex大头机器人素材.swf",
            "sha256": "4008c8785676464f8bc66659d07888cae1749376d4dd7f2beb286e9c51a1daaa"
          },
          {
            "path": "flashswf/arts/things-new.swf",
            "sha256": "0eeb0fe6eac14980a84fe6270ec193478aed1b3348556291a3e2b9a2d30b57f9"
          },
          {
            "path": "flashswf/arts/new/素材库-诺亚新敌人.swf",
            "sha256": "d8088f76a8ffa08c9c8e8a4d54ca9752fce8d696d475945b388ccaca7618adc6"
          },
          {
            "path": "scripts/asLoader.swf",
            "sha256": "31a993c9534d170d35d21e74caea8a73eb10b68a8a0bfa8d2b614cfe4c5a0752"
          },
          {
            "path": "data/enemy_properties/CF6重制敌人.xml",
            "sha256": "e93b0f188f91a349f61f115ffc9e164b672bbc496c76c04078f9835a9f815cbc"
          },
          {
            "path": "data/enemy_properties/诺亚新敌人.xml",
            "sha256": "d339f0a4de759cce186fe98dbdf8f1f966cacf1fa5bd803714d9d41ea331321b"
          },
          {
            "path": "data/units/units.json",
            "sha256": "13859cd4c7192857be1c2fe568fea34f213386d832012529cc2de0105044d868"
          },
          {
            "path": "data/items/asset_source_map.xml",
            "sha256": "493a827672392f3c7e5dd07345c7f9728c668bb0021e1d5ebcc9f328b31c3e7c"
          },
          {
            "path": "launcher/web/modules/arena-unit-catalog.js",
            "sha256": "d40778144f21450e4b59f089afec1478adedd34d47d532e0c3582bc1720bdda5"
          },
          {
            "path": "tools/cf6-headbot-assets/HeadbotAI.as",
            "sha256": "1176ef55d3c0ba96d1f98467542fe16cdc70a921b28548def3deddeb81ce50ea"
          },
          {
            "path": "tools/cf6-headbot-assets/build.py",
            "sha256": "69b83ff8a2a0441a42274051f263506ee5eace85709defc470993dde6f8f4003"
          },
          {
            "path": "tools/cf6-headbot-assets/native-manifest.json",
            "sha256": "f3a7535bd517346480ccead18c0a333101467b4ce0b529178df22026e9ce7207"
          },
          {
            "path": "tools/cf6-headbot-assets/balance-inputs.json",
            "sha256": "83ac79714f048a1007fb8b87ac11b631517489091761bdac874584c279a00e20"
          }
        ],
        "stage": 7,
        "targetPosition": "stable_wins_over_arkclaw",
        "tier": 16,
        "variant": "wave"
      },
      "caseHash": "sha256:0b757fbf066b0515f0b162e30809a13fdc4550c43eedb1f8583ebd8e91145bd5"
    }
  ],
  "manifestHash": "sha256:fd3de641db6fbfbb020c19fd6e1a7ffd90dacacb7d0beff74677a5bb30714710"
}
