{
  "schema": "arena-calibration.case-manifest.v1",
  "batchId": "gate-f-week-b6-p1",
  "createdAt": "2026-08-30T06:52:00.000Z",
  "buildCommit": "bcfa01935d2f91a29a8a537c328c9190827c4be3",
  "planner": {
    "name": "gate-f-week-plan",
    "version": 1,
    "phase": "standard",
    "candidateIds": [
      "candidate-27cd5fd027a411d3"
    ],
    "sourceCell": "B6",
    "sourceCandidateHash": "sha256:27cd5fd027a411d3abad55331a965c032ed07cb46ef92b17bdfe9bce98dde5e0",
    "phaseIndex": 1,
    "phaseRuns": 10
  },
  "arenaMode": "calibration",
  "repeat": 1,
  "timeoutFrames": 1800,
  "blueBench": null,
  "cases": [
    {
      "caseId": "candidate-27cd5fd027a411d3",
      "blueRoster": [
        {
          "type": "兵种260",
          "level": 20
        },
        {
          "type": "兵种86",
          "level": 20
        },
        {
          "type": "兵种353",
          "level": 20
        },
        {
          "type": "兵种354",
          "level": 20
        },
        {
          "type": "兵种46",
          "level": 20
        }
      ],
      "redRoster": [
        {
          "type": "兵种56",
          "level": 20
        },
        {
          "type": "兵种55",
          "level": 20
        },
        {
          "type": "兵种57",
          "level": 20
        },
        {
          "type": "兵种54",
          "level": 20
        },
        {
          "type": "兵种264",
          "level": 20
        }
      ],
      "repeat": 5,
      "timeoutFrames": 1800,
      "tags": [
        "xlsx-intake",
        "source-b6",
        "gate-f-week",
        "standard"
      ],
      "plannerReason": "workbook sha256:840b30af82ca686e954dc4a6378a5c2b297506070e034ed79ea91da9e0b3b793 斗兽标定组合!B6; Gate F standard original",
      "spawnDistance": 650,
      "blueFormation": "line",
      "redFormation": "line",
      "formationSpacing": 54,
      "caseHash": "sha256:ff52c564940c8a17819ca52b06f97d54fffa09399287fc1162287e39d29cc146"
    },
    {
      "caseId": "candidate-27cd5fd027a411d3-side-swap",
      "blueRoster": [
        {
          "type": "兵种56",
          "level": 20
        },
        {
          "type": "兵种55",
          "level": 20
        },
        {
          "type": "兵种57",
          "level": 20
        },
        {
          "type": "兵种54",
          "level": 20
        },
        {
          "type": "兵种264",
          "level": 20
        }
      ],
      "redRoster": [
        {
          "type": "兵种260",
          "level": 20
        },
        {
          "type": "兵种86",
          "level": 20
        },
        {
          "type": "兵种353",
          "level": 20
        },
        {
          "type": "兵种354",
          "level": 20
        },
        {
          "type": "兵种46",
          "level": 20
        }
      ],
      "repeat": 5,
      "timeoutFrames": 1800,
      "tags": [
        "xlsx-intake",
        "source-b6",
        "gate-f-week",
        "standard",
        "side-swap"
      ],
      "plannerReason": "workbook sha256:840b30af82ca686e954dc4a6378a5c2b297506070e034ed79ea91da9e0b3b793 斗兽标定组合!B6; Gate F standard swapped",
      "spawnDistance": 650,
      "blueFormation": "line",
      "redFormation": "line",
      "formationSpacing": 54,
      "caseHash": "sha256:0fd7fb597044131e8e450ab28f10d48e4691fc53bd2ee50bd53df7f49460922c"
    }
  ],
  "manifestHash": "sha256:a7d2acf104490edaca62f1b721b6be622aaa02ced188cec29a89ff764540123b"
}
