{
  "schema": "arena-calibration.case-manifest.v1",
  "batchId": "gate-f-week-d5-p2",
  "createdAt": "2026-08-30T11:07:00.000Z",
  "buildCommit": "f87ca1148f2635c2121ec8f92e40c059bc3e1036",
  "planner": {
    "name": "gate-f-week-plan",
    "version": 1,
    "phase": "standard",
    "candidateIds": [
      "candidate-07899540b1d0c4bc"
    ],
    "sourceCell": "D5",
    "sourceCandidateHash": "sha256:07899540b1d0c4bc985786ae5e196e71daf05b4af133bdb032d4b13b1e26b548",
    "phaseIndex": 2,
    "phaseRuns": 20
  },
  "arenaMode": "calibration",
  "repeat": 1,
  "timeoutFrames": 1800,
  "blueBench": null,
  "cases": [
    {
      "caseId": "candidate-07899540b1d0c4bc",
      "blueRoster": [
        {
          "type": "兵种264",
          "level": 30
        },
        {
          "type": "兵种56",
          "level": 20
        }
      ],
      "redRoster": [
        {
          "type": "兵种9",
          "level": 20
        },
        {
          "type": "兵种9",
          "level": 20
        },
        {
          "type": "兵种11",
          "level": 20
        }
      ],
      "repeat": 10,
      "timeoutFrames": 1800,
      "tags": [
        "xlsx-intake",
        "source-d5",
        "gate-f-week",
        "standard"
      ],
      "plannerReason": "workbook sha256:840b30af82ca686e954dc4a6378a5c2b297506070e034ed79ea91da9e0b3b793 斗兽标定组合!D5; Gate F standard original",
      "spawnDistance": 650,
      "blueFormation": "line",
      "redFormation": "line",
      "formationSpacing": 54,
      "caseHash": "sha256:c0b478b9cf61f6a1aeb5269ce8fd258887fa114611ed98c4281e4d7f087c3cde"
    },
    {
      "caseId": "candidate-07899540b1d0c4bc-side-swap",
      "blueRoster": [
        {
          "type": "兵种9",
          "level": 20
        },
        {
          "type": "兵种9",
          "level": 20
        },
        {
          "type": "兵种11",
          "level": 20
        }
      ],
      "redRoster": [
        {
          "type": "兵种264",
          "level": 30
        },
        {
          "type": "兵种56",
          "level": 20
        }
      ],
      "repeat": 10,
      "timeoutFrames": 1800,
      "tags": [
        "xlsx-intake",
        "source-d5",
        "gate-f-week",
        "standard",
        "side-swap"
      ],
      "plannerReason": "workbook sha256:840b30af82ca686e954dc4a6378a5c2b297506070e034ed79ea91da9e0b3b793 斗兽标定组合!D5; Gate F standard swapped",
      "spawnDistance": 650,
      "blueFormation": "line",
      "redFormation": "line",
      "formationSpacing": 54,
      "caseHash": "sha256:c9fdba1ee6867a8b8f803564b3f4ff3f8cfebcecdc646699fd2045c5f069d037"
    }
  ],
  "manifestHash": "sha256:2e22cea212d7f23ec928e8bcbbeae423611c77ffc2e66aea01a83aba3ad3eb44"
}
