{
  "schema": "arena-calibration.case-manifest.v1",
  "batchId": "cf6-cal-r10-integrated-20261018-exusiai-l30-w1",
  "createdAt": "2026-10-17T22:49:55.706Z",
  "buildCommit": "0392d8144c20d62261b01df54e6787b845f75e73",
  "planner": {
    "name": "cf6-elder-exusiai",
    "version": 2
  },
  "arenaMode": "calibration",
  "repeat": 1,
  "timeoutFrames": 5400,
  "blueBench": null,
  "cases": [
    {
      "caseId": "level30-blue",
      "blueRoster": [
        {
          "type": "兵种471",
          "level": 30,
          "sourceId": "elder-30"
        }
      ],
      "redRoster": [
        {
          "type": "兵种361",
          "level": 30,
          "sourceId": "exusiai-30"
        }
      ],
      "repeat": 1,
      "timeoutFrames": 5400,
      "tags": [
        "cf6-elder",
        "exusiai",
        "two-phase",
        "blue"
      ],
      "plannerReason": "同等级、交换阵营验证人形后接机器人，保留全部重复、胜负、阶段生成和超时。",
      "spawnDistance": 650,
      "blueFormation": "line",
      "redFormation": "line",
      "formationSpacing": 54,
      "authorityContext": {
        "candidateSide": "blue",
        "candidateUnitId": 471,
        "level": 30,
        "rivalUnitId": 361,
        "sourceBindings": [
          {
            "path": "flashswf/arts/new/Codex老头素材.swf",
            "sha256": "4a64dc376d94205a81ee7fc90e5e0501c9e451ebdeeb7f20e5a3d3e13396f47a"
          },
          {
            "path": "flashswf/arts/things-new.swf",
            "sha256": "0eeb0fe6eac14980a84fe6270ec193478aed1b3348556291a3e2b9a2d30b57f9"
          },
          {
            "path": "flashswf/arts/things5.swf",
            "sha256": "3dd416785b4efa7f2a4423fc830e39171caaa021d025243db469ffcf93dac75f"
          },
          {
            "path": "flashswf/arts/new/偷吃屑鱼坟头贡品.swf",
            "sha256": "5c3b65d40ab8ac7de5700b44df2475139260e895870f780e3b5eddb40df70639"
          },
          {
            "path": "scripts/asLoader.swf",
            "sha256": "c3efc175d6129707ef586cc0dbb68adfbdeac740426bedb63778a39ba330527c"
          },
          {
            "path": "data/enemy_properties/CF6重制敌人.xml",
            "sha256": "cf2164bcfa70070432df2a20b0766fe700c935b5621913d755910476cb8f3333"
          },
          {
            "path": "data/enemy_properties/原版敌人 2013-2016.xml",
            "sha256": "7142b6d13fa357758f6c527b10f4314fee90e5d7e37e620be4cde45652dc6ece"
          },
          {
            "path": "data/enemy_properties/天网.xml",
            "sha256": "37639ad43a8a1ed968b633181132e87bb98e66d6565131a00188c4ff9cfa7ccb"
          },
          {
            "path": "data/units/units.json",
            "sha256": "13859cd4c7192857be1c2fe568fea34f213386d832012529cc2de0105044d868"
          },
          {
            "path": "data/items/asset_source_map.xml",
            "sha256": "493a827672392f3c7e5dd07345c7f9728c668bb0021e1d5ebcc9f328b31c3e7c"
          },
          {
            "path": "launcher/web/modules/arena-unit-catalog.js",
            "sha256": "d40778144f21450e4b59f089afec1478adedd34d47d532e0c3582bc1720bdda5"
          },
          {
            "path": "tools/cf6-elder-assets/ElderAI.as",
            "sha256": "8e7b193a056130894c13c5c28670951f48462fc68ebe76654ee4fefc1bf6d65b"
          },
          {
            "path": "tools/cf6-elder-assets/ElderTransform.as",
            "sha256": "f6818dda6c1ea4d200af22b977ddde4cea80c93efcab153216baebb7252b377c"
          },
          {
            "path": "tools/cf6-elder-assets/build.py",
            "sha256": "6f7fbe47708cba37d3af74d09feb58989b409d386cfb1f1ebfc2326acdd18be4"
          },
          {
            "path": "tools/cf6-elder-assets/native-manifest.json",
            "sha256": "4b337c4f35d5f13aa9bd9076bc5cd3582c249c24ba6289b7e6f762ad87850943"
          },
          {
            "path": "tools/cf6-elder-assets/balance-inputs.json",
            "sha256": "29fec8230664f294b7fd8fcba0ef05e4a0358c05253cf206f817e1beaab31758"
          },
          {
            "path": "scripts/逻辑/单位函数/单位函数_lsy_敌人模板迁移.as",
            "sha256": "a213be1bfe7b094c6fdbaf173afe2ff36da71038838f7a82189ab23f3388aef0"
          }
        ],
        "stage": 8,
        "successorTier": 20,
        "successorUnitId": 472,
        "targetPosition": "significant_threat_without_victory",
        "tier": 9,
        "variant": "two-phase"
      },
      "caseHash": "sha256:4e86e8fb56e5ac34641f0259ce514637d8948bde0bd094c9c8f4fca36d64112d"
    },
    {
      "caseId": "level30-red",
      "blueRoster": [
        {
          "type": "兵种361",
          "level": 30,
          "sourceId": "exusiai-30"
        }
      ],
      "redRoster": [
        {
          "type": "兵种471",
          "level": 30,
          "sourceId": "elder-30"
        }
      ],
      "repeat": 1,
      "timeoutFrames": 5400,
      "tags": [
        "cf6-elder",
        "exusiai",
        "two-phase",
        "red"
      ],
      "plannerReason": "同等级、交换阵营验证人形后接机器人，保留全部重复、胜负、阶段生成和超时。",
      "spawnDistance": 650,
      "blueFormation": "line",
      "redFormation": "line",
      "formationSpacing": 54,
      "authorityContext": {
        "candidateSide": "red",
        "candidateUnitId": 471,
        "level": 30,
        "rivalUnitId": 361,
        "sourceBindings": [
          {
            "path": "flashswf/arts/new/Codex老头素材.swf",
            "sha256": "4a64dc376d94205a81ee7fc90e5e0501c9e451ebdeeb7f20e5a3d3e13396f47a"
          },
          {
            "path": "flashswf/arts/things-new.swf",
            "sha256": "0eeb0fe6eac14980a84fe6270ec193478aed1b3348556291a3e2b9a2d30b57f9"
          },
          {
            "path": "flashswf/arts/things5.swf",
            "sha256": "3dd416785b4efa7f2a4423fc830e39171caaa021d025243db469ffcf93dac75f"
          },
          {
            "path": "flashswf/arts/new/偷吃屑鱼坟头贡品.swf",
            "sha256": "5c3b65d40ab8ac7de5700b44df2475139260e895870f780e3b5eddb40df70639"
          },
          {
            "path": "scripts/asLoader.swf",
            "sha256": "c3efc175d6129707ef586cc0dbb68adfbdeac740426bedb63778a39ba330527c"
          },
          {
            "path": "data/enemy_properties/CF6重制敌人.xml",
            "sha256": "cf2164bcfa70070432df2a20b0766fe700c935b5621913d755910476cb8f3333"
          },
          {
            "path": "data/enemy_properties/原版敌人 2013-2016.xml",
            "sha256": "7142b6d13fa357758f6c527b10f4314fee90e5d7e37e620be4cde45652dc6ece"
          },
          {
            "path": "data/enemy_properties/天网.xml",
            "sha256": "37639ad43a8a1ed968b633181132e87bb98e66d6565131a00188c4ff9cfa7ccb"
          },
          {
            "path": "data/units/units.json",
            "sha256": "13859cd4c7192857be1c2fe568fea34f213386d832012529cc2de0105044d868"
          },
          {
            "path": "data/items/asset_source_map.xml",
            "sha256": "493a827672392f3c7e5dd07345c7f9728c668bb0021e1d5ebcc9f328b31c3e7c"
          },
          {
            "path": "launcher/web/modules/arena-unit-catalog.js",
            "sha256": "d40778144f21450e4b59f089afec1478adedd34d47d532e0c3582bc1720bdda5"
          },
          {
            "path": "tools/cf6-elder-assets/ElderAI.as",
            "sha256": "8e7b193a056130894c13c5c28670951f48462fc68ebe76654ee4fefc1bf6d65b"
          },
          {
            "path": "tools/cf6-elder-assets/ElderTransform.as",
            "sha256": "f6818dda6c1ea4d200af22b977ddde4cea80c93efcab153216baebb7252b377c"
          },
          {
            "path": "tools/cf6-elder-assets/build.py",
            "sha256": "6f7fbe47708cba37d3af74d09feb58989b409d386cfb1f1ebfc2326acdd18be4"
          },
          {
            "path": "tools/cf6-elder-assets/native-manifest.json",
            "sha256": "4b337c4f35d5f13aa9bd9076bc5cd3582c249c24ba6289b7e6f762ad87850943"
          },
          {
            "path": "tools/cf6-elder-assets/balance-inputs.json",
            "sha256": "29fec8230664f294b7fd8fcba0ef05e4a0358c05253cf206f817e1beaab31758"
          },
          {
            "path": "scripts/逻辑/单位函数/单位函数_lsy_敌人模板迁移.as",
            "sha256": "a213be1bfe7b094c6fdbaf173afe2ff36da71038838f7a82189ab23f3388aef0"
          }
        ],
        "stage": 8,
        "successorTier": 20,
        "successorUnitId": 472,
        "targetPosition": "significant_threat_without_victory",
        "tier": 9,
        "variant": "two-phase"
      },
      "caseHash": "sha256:f5faa67f2ebcf5981d5c36fbaf94e83acd5cc3dbae956d49d736e980316360cb"
    }
  ],
  "manifestHash": "sha256:08bce818e6bd2beb5e38e0fa4c67299b6a76d46c6f41a0b14ac99296f91fcf49"
}
